{
  "steps": ["S-001"],
  "description": "Add the --version flag and its test.",
  "changed_paths_claimed": ["main.go", "main_test.go", "go.sum"],
  "off_target_justifications": [{"path": "go.sum", "reason": "checksum for the test dependency added by S-001"}],
  "proposed_checks": [
    {"id": "go-test", "method": "test", "argv": ["go", "test", "./..."], "cwd": ".", "timeout": "10m", "expected": {"exit_code": 0}, "criterion_ids": ["R-001.C1"], "verification_ids": ["S-001/V-001"]},
    {"id": "review-flag-doc", "method": "inspect", "expected": {}, "criterion_ids": ["R-001.C2"], "verification_ids": ["S-001/V-002"]}
  ],
  "questions": [],
  "handoff": {
    "implementation_notes": ["version string comes from the RELEASE file at build time"],
    "remaining_work": [],
    "risks": ["RELEASE file missing in CI would print unknown"],
    "decision_refs": ["D-001"],
    "evidence_refs": ["checks/go-test"]
  }
}
